<?xml version="1.0" encoding="UTF-8"?>
<!--
Licensed to the Apache Software Foundation (ASF) under one
or more contributor license agreements.  See the NOTICE file
distributed with this work for additional information
regarding copyright ownership.  The ASF licenses this file
to you under the Apache License, Version 2.0 (the
"License"); you may not use this file except in compliance
with the License.  You may obtain a copy of the License at

http://www.apache.org/licenses/LICENSE-2.0

Unless required by applicable law or agreed to in writing,
software distributed under the License is distributed on an
"AS IS" BASIS, WITHOUT WARRANTIES OR CONDITIONS OF ANY
KIND, either express or implied.  See the License for the
specific language governing permissions and limitations
under the License.
-->

<menus xmlns:xsi="http://www.w3.org/2001/XMLSchema-instance" 
    xsi:noNamespaceSchemaLocation="http://www.ofbiz.org/dtds/widget-menu.xsd">      

    <menu name="editRequest" default-title-style="tabButton"
        default-selected-style="tabButtonSelected"
        default-menu-item-name="content"
        orientation="horizontal"
        menu-width="100%"
        default-tooltip-style="tabletext" default-widget-style="tabButton"
        default-associated-content-id="${userLogin.userLoginId}"
        selected-menuitem-context-field-name="currentRequestMenuItemName"
        title="" type="simple">

        <menu-item name="request" title="Request" >
            <link id="requestheader" target="request?custRequestId=${custRequest.custRequestId}"/>
        </menu-item>
        <menu-item name="requestroles" title="Request Roles" >
            <link id="requestroles" target="requestroles?custRequestId=${custRequest.custRequestId}"/>
        </menu-item>
        <menu-item name="requestitems" title="Request Items" >
            <link id="requestitems" target="/requestitems?custRequestId=${custRequest.custRequestId}">
            </link>
        </menu-item>
    </menu>

    <menu name="editrequestitemmenu" default-title-style="tabButton"
        default-selected-style="tabButtonSelected"
        default-menu-item-name="content"
        orientation="horizontal"
        menu-width="100%"
        default-tooltip-style="tabletext" default-widget-style="tabButton"
        default-associated-content-id="${userLogin.userLoginId}"
        title="" type="simple">

        <menu-item name="requestitem">
            <link id="requestitem" target="requestitem?custRequestId=${custRequest.custRequestId}&amp;custRequestItemSeqId=${custRequestItem.custRequestItemSeqId}"/>
        </menu-item>
        <menu-item name="requestitemnotes" title="Request Item Notes" >
            <link id="requestitemnotes" target="requestitemnotes?custRequestId=${custRequest.custRequestId}&amp;custRequestItemSeqId=${custRequestItem.custRequestItemSeqId}"/>
        </menu-item>
        <menu-item name="requestitemquotes" title="Request Item Quotes" >
            <link id="requestitemquotes" target="RequestItemQuotes?custRequestId=${custRequest.custRequestId}&amp;custRequestItemSeqId=${custRequestItem.custRequestItemSeqId}"/>
        </menu-item>
        <menu-item name="workeffortrequirements" title="WorkEffort Requirements" >
            <link id="workeffortrequirements" target="requestitemrequirements?custRequestId=${custRequest.custRequestId}&amp;custRequestItemSeqId=${custRequestItem.custRequestItemSeqId}"/>
        </menu-item>
    </menu>
</menus>

